locale,filename,raw_gold,normalized_gold
en-US,conv-0-turn-0.gold.txt,Hi. I want to get a higher limit on my credit card.,hi i want to get a higher limit on my credit card
en-US,conv-0-turn-1.gold.txt,C N 7 3 4 7 8 5 8.,c n seven three four seven eight five eight
en-US,conv-0-turn-10.gold.txt,I don't know. Is there anything else you can help me with?,i do not know is there anything else you can help me with
en-US,conv-0-turn-11.gold.txt,Yeah. Let's check my card status.,yes let us check my card status
en-US,conv-0-turn-12.gold.txt,Sure.,sure
en-US,conv-0-turn-13.gold.txt,Yes.,yes
en-US,conv-0-turn-14.gold.txt,"Yes, please.",yes please
en-US,conv-0-turn-15.gold.txt,What else can you help me with?,what else can you help me with
en-US,conv-0-turn-16.gold.txt,Um I think you covered everything I needed help with.,i think you covered everything i needed help with
en-US,conv-0-turn-17.gold.txt,Thank you.,thank you
en-US,conv-0-turn-2.gold.txt,Ashley Brown.,ashley brown
en-US,conv-0-turn-3.gold.txt,Ashley dot Brown at email dot com.,ashley dot brown at email dot com
en-US,conv-0-turn-4.gold.txt,1 2 1 2 1 2 3 4 5 6 7.,one two one two one two three four five six seven
en-US,conv-0-turn-5.gold.txt,Correct.,correct
en-US,conv-0-turn-6.gold.txt,I see it.,i see it
en-US,conv-0-turn-7.gold.txt,I completed the steps.,i completed the steps
en-US,conv-0-turn-8.gold.txt,Hello?,hello
en-US,conv-0-turn-9.gold.txt,Um.,
en-US,conv-1-turn-0.gold.txt,Yeah. I'm trying to find more money from my credit card.,yeah i am trying to find more money from my credit card
en-US,conv-1-turn-1.gold.txt,"Okay, yeah. Let me get that. Wait, hold on. I'm gonna get need a pen for that case tracking code. One second, please.",okay yeah let me get that wait hold on i am going to get need a pen for that case tracking code one second please
en-US,conv-1-turn-10.gold.txt,How much will that credit limit increase be?,how much will that credit limit increase be
en-US,conv-1-turn-11.gold.txt,Thank you.,thank you
en-US,conv-1-turn-12.gold.txt,Oh.,oh
en-US,conv-1-turn-13.gold.txt,Do you need more information from me before we go there?,do you need more information from me before we go there
en-US,conv-1-turn-14.gold.txt,"You have everything you need. Sorry, what was that?",you have everything you need sorry what was that
en-US,conv-1-turn-15.gold.txt,"Okay, yeah. Yeah, let's go ahead and go to that live agent then. Thank you.",okay yeah yeah let us go ahead and go to that live agent then thank you
en-US,conv-1-turn-16.gold.txt,"You know, 6 7. I think that should be fine. Let's try to transfer me over right now, and if it doesn't work, that's fine.",you know six seven i think that should be fine let us try to transfer me over right now and if it does not work that is fine
en-US,conv-1-turn-17.gold.txt,Okay. Thanks a lot.,okay thanks a lot
en-US,conv-1-turn-2.gold.txt,Okay. I am ready. Go for it.,okay i am ready go for it
en-US,conv-1-turn-3.gold.txt,So I got A S 1 5 7 1.,so i got a s one five seven one
en-US,conv-1-turn-4.gold.txt,Thank you.,thank you
en-US,conv-1-turn-5.gold.txt,"Oh, okay. You said you need three pieces to confirm my identity?",oh okay you said you need three pieces to confirm my identity
en-US,conv-1-turn-6.gold.txt,Okay. My name is John Brown.,okay my name is john brown
en-US,conv-1-turn-7.gold.txt,That would be John dot Brown at email dot com.,that would be john dot brown at email dot com
en-US,conv-1-turn-8.gold.txt,Okay. So my phone number is 1 2 1 2 1 2 3 4 5 6 7. 6 7.,okay so my phone number is one two one two one two three four five six seven six seven
en-US,conv-1-turn-9.gold.txt,Correct.,correct
en-US,conv-10-turn-0.gold.txt,Hi. Yeah. Hi. I'm sorry. I'm outside right now so you might hear some noise. I had a couple of questions about my credit card account.,hi yeah hi i am sorry i am outside right now so you might hear some noise i had a couple of questions about my credit card account
en-US,conv-10-turn-1.gold.txt,Yes.,yes
en-US,conv-10-turn-2.gold.txt,C N 3 5 4.,c n three five four
en-US,conv-10-turn-3.gold.txt,C N 3 5 4 8 8 6.,c n three five four eight eight six
en-US,conv-11-turn-0.gold.txt,"Yeah. Hi. Sorry, I might have some noise around.",yeah hi sorry i might have some noise around
en-US,conv-11-turn-1.gold.txt,I had a couple of questions about my credit card accounts.,i had a couple of questions about my credit card accounts
en-US,conv-11-turn-2.gold.txt,Yes.,yes
en-US,conv-11-turn-3.gold.txt,C N 8 6 7 9 6 6.,c n eight six seven nine six six
en-US,conv-11-turn-4.gold.txt,No.,no
en-US,conv-11-turn-5.gold.txt,Sarah Johnson.,sarah johnson
en-US,conv-12-turn-0.gold.txt,"Hi, yeah. Hi. You might hear some noise in the background.",hi yeah hi you might hear some noise in the background
en-US,conv-12-turn-1.gold.txt,I had a couple of questions about my credit card account.,i had a couple of questions about my credit card account
en-US,conv-12-turn-10.gold.txt,Yes.,yes
en-US,conv-12-turn-11.gold.txt,"Well, I first wanted to check on the status of a replacement card I requested recently.",well i first wanted to check on the status of a replacement card i requested recently
en-US,conv-12-turn-12.gold.txt,"And also, I was wondering if it's possible to look into a credit limit increase.",and also i was wondering if it is possible to look into a credit limit increase
en-US,conv-12-turn-13.gold.txt,I'm sorry. Can you say that again?,i am sorry can you say that again
en-US,conv-12-turn-14.gold.txt,No. But I wanted to know if you knew anything about what other options I can have that are available?,no but i wanted to know if you knew anything about what other options i can have that are available
en-US,conv-12-turn-15.gold.txt,Any recent offers you're offering?,any recent offers you are offering
en-US,conv-12-turn-2.gold.txt,No. Can you repeat that again?,no can you repeat that again
en-US,conv-12-turn-3.gold.txt,Repeat that again.,repeat that again
en-US,conv-12-turn-4.gold.txt,Repeat it again.,repeat it again
en-US,conv-12-turn-5.gold.txt,Okay. Did you say C N 0 8 7 3 6 7 2 5?,okay did you say c n zero eight seven three six seven two five
en-US,conv-12-turn-6.gold.txt,Okay. C N 0 7 3 6 7 2 5.,okay c n zero seven three six seven two five
en-US,conv-12-turn-7.gold.txt,Ashley Brown.,ashley brown
en-US,conv-12-turn-8.gold.txt,Ashley dot Brown at email dot com. All lowercase.,ashley dot brown at email dot com all lowercase
en-US,conv-12-turn-9.gold.txt,Yes. Plus 1 2 1 2 1 2 3 4 5 6 7.,yes plus one two one two one two three four five six seven
en-US,conv-13-turn-0.gold.txt,Hi. Yeah. Sorry. There might be some noise in the background.,hi yeah sorry there might be some noise in the background
en-US,conv-13-turn-1.gold.txt,Just calling to ask a few questions about my credit card. Nothing urgent. Mostly just information only.,just calling to ask a few questions about my credit card nothing urgent mostly just information only
en-US,conv-13-turn-10.gold.txt,"Like are they based on usage, payment history, or how long you had the card.",like are they based on usage payment history or how long you had the card
en-US,conv-13-turn-11.gold.txt,"Okay. I mean, I know that makes sense. Can you answer if someone wants to request an increase, is that usually something that you can do online or by calling in like this?",okay i mean i know that makes sense can you answer if someone wants to request an increase is that usually something that you can do online or by calling in like this
en-US,conv-13-turn-12.gold.txt,I see. And does requesting an increase affect anything right away?,i see and does requesting an increase affect anything right away
en-US,conv-13-turn-13.gold.txt,Ah. Cause I've heard different things about that so I just want to clarify.,ah because i have heard different things about that so i just want to clarify
en-US,conv-13-turn-14.gold.txt,I see. Another thing I was curious about is replacement cards.,i see another thing i was curious about is replacement cards
en-US,conv-13-turn-15.gold.txt,"When a replacement card is issued, does it usually keep the same billing cycle and due dates?",when a replacement card is issued does it usually keep the same billing cycle and due dates
en-US,conv-13-turn-16.gold.txt,"Oh. Okay. And do you know if while waiting for a replacement card, is it normal for digital access to still work?",oh okay and do you know if while waiting for a replacement card is it normal for digital access to still work
en-US,conv-13-turn-17.gold.txt,"Oh. Okay. Well, you really didn't give me enough information that I was looking for. I do just like to understand how things work before I actually request anything.",oh okay well you really did not give me enough information that i was looking for i do just like to understand how things work before i actually request anything
en-US,conv-13-turn-18.gold.txt,Thanks for taking the time to explain all that to me.,thanks for taking the time to explain all that to me
en-US,conv-13-turn-2.gold.txt,I was wondering how credit limit increases usually work in general.,i was wondering how credit limit increases usually work in general
en-US,conv-13-turn-3.gold.txt,"Yes, please.",yes please
en-US,conv-13-turn-4.gold.txt,Can you say it again but a little bit slower?,can you say it again but a little bit slower
en-US,conv-13-turn-5.gold.txt,"Okay. So, did you say C N 2 1 8 8 7 5 4?",okay so did you say c n two one eight eight seven five four
en-US,conv-13-turn-6.gold.txt,Yes. Ashley Brown.,yes ashley brown
en-US,conv-13-turn-7.gold.txt,All lower case Ashley dot Brown at email dot com.,all lower case ashley dot brown at email dot com
en-US,conv-13-turn-8.gold.txt,Yes. 2 1 2 1 2 3 4 5 6 7.,yes two one two one two three four five six seven
en-US,conv-13-turn-9.gold.txt,Yes.,yes
en-US,conv-14-turn-0.gold.txt,Yeah. Hi. I'm looking for if I can get the latest invoice for my card.,yeah hi i am looking for if i can get the latest invoice for my card
en-US,conv-14-turn-1.gold.txt,Correct. Latest invoice.,correct latest invoice
en-US,conv-14-turn-10.gold.txt,Okay. It is John Brown.,okay it is john brown
en-US,conv-14-turn-11.gold.txt,Email address should be John dot Brown at email dot com.,email address should be john dot brown at email dot com
en-US,conv-14-turn-12.gold.txt,Phone number would be 1 2 1 2 1 2 3 4 5 6 7.,phone number would be one two one two one two three four five six seven
en-US,conv-14-turn-13.gold.txt,Sounds good.,sounds good
en-US,conv-14-turn-14.gold.txt,Perfect.,perfect
en-US,conv-14-turn-15.gold.txt,Send it to my email.,send it to my email
en-US,conv-14-turn-16.gold.txt,Would you be available to tell me also what my credit limit is?,would you be available to tell me also what my credit limit is
en-US,conv-14-turn-17.gold.txt,Okay.,okay
en-US,conv-14-turn-18.gold.txt,Yep.,yes
en-US,conv-14-turn-19.gold.txt,Correct. Correct.,correct correct
en-US,conv-14-turn-2.gold.txt,"No, I'm not. Let me get something to write that down, okay?",no i am not let me get something to write that down okay
en-US,conv-14-turn-20.gold.txt,Thank you.,thank you
en-US,conv-14-turn-21.gold.txt,Oh.,oh
en-US,conv-14-turn-22.gold.txt,Okay. Go ahead and connect me. I'd love that. Thank you so much.,okay go ahead and connect me i would love that thank you so much
en-US,conv-14-turn-23.gold.txt,Perfect.,perfect
en-US,conv-14-turn-24.gold.txt,Okay. Thank you.,okay thank you
en-US,conv-14-turn-25.gold.txt,Oh.,oh
en-US,conv-14-turn-26.gold.txt,Nope. That's it. Thank you so much for your help. Really appreciate it.,nope that is it thank you so much for your help really appreciate it
en-US,conv-14-turn-27.gold.txt,"Perfect. Thank. You, too. Thank you much. Goodbye.",perfect thank you too thank you much goodbye
en-US,conv-14-turn-3.gold.txt,Alright. Let's go ahead and do it.,alright let us go ahead and do it
en-US,conv-14-turn-4.gold.txt,Hello? Can you give what is 7 6 2?,hello can you give what is seven six two
en-US,conv-14-turn-5.gold.txt,I'm good. I could repeat it to you now.,i am good i could repeat it to you now
en-US,conv-14-turn-6.gold.txt,C N 7 6 2 4 2 0 6. Is that correct?,c n seven six two four two zero six is that correct
en-US,conv-14-turn-7.gold.txt,Okay.,okay
en-US,conv-14-turn-8.gold.txt,"Oh, okay. What information do you need from me?",oh okay what information do you need from me
en-US,conv-14-turn-9.gold.txt,Mhm.,
en-US,conv-15-turn-0.gold.txt,"Hi, Anna. I'm looking to find out where my replacement card is. It's been a while, and just want to make sure that it didn't get lost in the mail or anything like that.",hi anna i am looking to find out where my replacement card is it has been a while and just want to make sure that it did not get lost in the mail or anything like that
en-US,conv-15-turn-1.gold.txt,Thank you.,thank you
en-US,conv-15-turn-10.gold.txt,Okay. Thank you.,okay thank you
en-US,conv-15-turn-11.gold.txt,Do you know how long the shipping time would be?,do you know how long the shipping time would be
en-US,conv-15-turn-12.gold.txt,Okay. Thank you.,okay thank you
en-US,conv-15-turn-13.gold.txt,Okay.,okay
en-US,conv-15-turn-14.gold.txt,"Okay. Actually, before being transferred, I would like to ask how much is left on credit? I made quite a few purchases. I just want to make sure I know how much is left on the credit card.",okay actually before being transferred i would like to ask how much is left on credit i made quite a few purchases i just want to make sure i know how much is left on the credit card
en-US,conv-15-turn-15.gold.txt,Hmm.,
en-US,conv-15-turn-16.gold.txt,"Yeah, go ahead and send me to a live agent, please.",yeah go ahead and send me to a live agent please
en-US,conv-15-turn-17.gold.txt,"You know, I think I'll try again later. Would there be like a case number or anything, or do I just give them the tracking number that you gave me?",you know i think i will try again later would there be like a case number or anything or do i just give them the tracking number that you gave me
en-US,conv-15-turn-18.gold.txt,"Okay. Nope, that's it. Thank you so much for your help. I really appreciate it.",okay nope that is it thank you so much for your help i really appreciate it
en-US,conv-15-turn-19.gold.txt,"Perfect. You, too. Thank you so much.",perfect you too thank you so much
en-US,conv-15-turn-2.gold.txt,No. Can you repeat it back to me but slower?,no can you repeat it back to me but slower
en-US,conv-15-turn-20.gold.txt,"You, too. Goodbye.",you too goodbye
en-US,conv-15-turn-3.gold.txt,C N 1 7 3 1 3 4 7.,c n one seven three one three four seven
en-US,conv-15-turn-4.gold.txt,Okay.,okay
en-US,conv-15-turn-5.gold.txt,My full name is John Brown.,my full name is john brown
en-US,conv-15-turn-6.gold.txt,Email address would be John dot Brown at email dot com.,email address would be john dot brown at email dot com
en-US,conv-15-turn-7.gold.txt,Phone number would be 1 2 1 2 1 2 3 4 5 6 7.,phone number would be one two one two one two three four five six seven
en-US,conv-15-turn-8.gold.txt,That is correct.,that is correct
en-US,conv-15-turn-9.gold.txt,Okay. Do you know when I ordered that card?,okay do you know when i ordered that card
en-US,conv-16-turn-0.gold.txt,"Hi, yeah. I'm just calling in cause I've been having a lot of trouble making purchases on the credit card, and basically getting blocked in terms of those purchases not going through. I'm just kind of trying to figure out what's going on.",hi yeah i am just calling in because i have been having a lot of trouble making purchases on the credit card and basically getting blocked in terms of those purchases not going through i am just kind of trying to figure out what is going on
en-US,conv-16-turn-1.gold.txt,Correct.,correct
en-US,conv-16-turn-10.gold.txt,"Let's see. For this account, oh, it's 1 2 1 2 1 2 3 4 5 6 7.",let us see for this account oh it is one two one two one two three four five six seven
en-US,conv-16-turn-11.gold.txt,"Give me the phone number again, please.",give me the phone number again please
en-US,conv-16-turn-12.gold.txt,That is correct.,that is correct
en-US,conv-16-turn-13.gold.txt,Okay. Thank you.,okay thank you
en-US,conv-16-turn-14.gold.txt,Oh. That's probably why I couldn't make those purchases.,oh that is probably why i could not make those purchases
en-US,conv-16-turn-15.gold.txt,Mhm.,
en-US,conv-16-turn-16.gold.txt,"That is Yeah. So, let me know when. When will it be available for me? Cause I really want to buy that motorbike.",that is yeah so let me know when when will it be available for me because i really want to buy that motorbike
en-US,conv-16-turn-17.gold.txt,Thank you.,thank you
en-US,conv-16-turn-18.gold.txt,"Oh, no.",oh no
en-US,conv-16-turn-19.gold.txt,"Ah, yeah. Yeah. Send me to a live agent, please. I mean, but before going to that live A, like is this pretty common?",yeah yeah send me to a live agent please i mean but before going to that live a like is this pretty common
en-US,conv-16-turn-2.gold.txt,Perfect.,perfect
en-US,conv-16-turn-20.gold.txt,Mhm. Okay.,okay
en-US,conv-16-turn-21.gold.txt,"Okay. Go ahead and send me to that live agent, please.",okay go ahead and send me to that live agent please
en-US,conv-16-turn-22.gold.txt,No.,no
en-US,conv-16-turn-23.gold.txt,"Try one more time. Try one more time, please.",try one more time try one more time please
en-US,conv-16-turn-24.gold.txt,Thank you.,thank you
en-US,conv-16-turn-25.gold.txt,Mhm.,
en-US,conv-16-turn-26.gold.txt,I think I'll probably give a call back in a day or two. Do I just reference that track number?,i think i will probably give a call back in a day or two do i just reference that track number
en-US,conv-16-turn-27.gold.txt,Okay. Perfect. That's what I'll Thank you so much for your help.,okay perfect that is what i will thank you so much for your help
en-US,conv-16-turn-28.gold.txt,"You, too. Goodbye.",you too goodbye
en-US,conv-16-turn-3.gold.txt,One second.,one second
en-US,conv-16-turn-4.gold.txt,"Go ahead, and can you say it slowly so I can get it all down correctly?",go ahead and can you say it slowly so i can get it all down correctly
en-US,conv-16-turn-5.gold.txt,"Actually, repeat it back to me just the numbers this time.",actually repeat it back to me just the numbers this time
en-US,conv-16-turn-6.gold.txt,C N 6 1 4 5 7 5 1.,c n six one four five seven five one
en-US,conv-16-turn-7.gold.txt,Okay. What are those informations that you need?,okay what are those informations that you need
en-US,conv-16-turn-8.gold.txt,"So, the name on the account is John Brown.",so the name on the account is john brown
en-US,conv-16-turn-9.gold.txt,"Let me see. For this account, my email address would be, oh, John dot Brown at email dot com.",let me see for this account my email address would be john dot brown at email dot com
en-US,conv-17-turn-0.gold.txt,"Hi. You know, I've called before for other reasons, but I'm calling today because it's been really frustrating. I ordered a replacement card because my card was stolen. And you know, I still haven't received it. It's been about 2 weeks and I haven't been able to make any purchases or whatnot. And it's just getting really frustrating. I just wanna know where my card is. Has it been sent? You know. Like, what's going on?",hi you know i have called before for other reasons but i am calling today because it has been really frustrating i ordered a replacement card because my card was stolen and you know i still have not received it it has been about two weeks and i have not been able to make any purchases or whatnot and it is just getting really frustrating i just want to know where my card is has it been sent you know like what is going on
en-US,conv-17-turn-1.gold.txt,Sorry. Can you give me the numbers one more time?,sorry can you give me the numbers one more time
en-US,conv-17-turn-10.gold.txt,"So, it is John dot Brown at email dot com. Is that what you had?",so it is john dot brown at email dot com is that what you had
en-US,conv-17-turn-11.gold.txt,Perfect.,perfect
en-US,conv-17-turn-12.gold.txt,Okay.,okay
en-US,conv-17-turn-13.gold.txt,Is I would love Is it the same tracking number you already gave me or is there a new tracking number?,is i would love is it the same tracking number you already gave me or is there a new tracking number
en-US,conv-17-turn-14.gold.txt,"Oh. Okay. Yeah. Let me get the tracking number for that, please.",oh okay yeah let me get the tracking number for that please
en-US,conv-17-turn-15.gold.txt,Oh.,oh
en-US,conv-17-turn-16.gold.txt,"Do you have any like ship date like date of arrival, you know, possible?",do you have any like ship date like date of arrival you know possible
en-US,conv-17-turn-17.gold.txt,Okay. Alright.,okay alright
en-US,conv-17-turn-18.gold.txt,Mhm.,
en-US,conv-17-turn-19.gold.txt,Yeah. Go ahead and transfer me to a live agent. Yeah. I'm just really trying to get that part.,yeah go ahead and transfer me to a live agent yeah i am just really trying to get that part
en-US,conv-17-turn-2.gold.txt,Here we go. C N 4 0 9 3 7 1 1.,here we go c n four zero nine three seven one one
en-US,conv-17-turn-20.gold.txt,"Oh, no.",oh no
en-US,conv-17-turn-21.gold.txt,"You now, let's try it one more time. Let's give it a shot. I just really wanna know where that card is right now.",you now let us try it one more time let us give it a shot i just really want to know where that card is right now
en-US,conv-17-turn-22.gold.txt,Mhm.,
en-US,conv-17-turn-23.gold.txt,What would you recommend? Would you recommend me calling back like tomorrow and maybe a live agent will be available?,what would you recommend would you recommend me calling back like tomorrow and maybe a live agent will be available
en-US,conv-17-turn-24.gold.txt,"Okay. How would I reference, you know, basically, I don't wanna go through everything we already talked about. So, 0 like our case number.",okay how would i reference you know basically i do not want to go through everything we already talked about so zero like our case number
en-US,conv-17-turn-25.gold.txt,Okay.,okay
en-US,conv-17-turn-26.gold.txt,"Sounds good. No, that's it. I'll definitely go ahead and call tomorrow. Thank you so much.",sounds good no that is it i will definitely go ahead and call tomorrow thank you so much
en-US,conv-17-turn-27.gold.txt,"You, too. Goodbye.",you too goodbye
en-US,conv-17-turn-3.gold.txt,Okay.,okay
en-US,conv-17-turn-4.gold.txt,"Okay. Hopefully, I get all that information for you. Let's see here. My full name for this account would be John Brown.",okay hopefully i get all that information for you let us see here my full name for this account would be john brown
en-US,conv-17-turn-5.gold.txt,"Let me check. Give me a second, okay?",let me check give me a second okay
en-US,conv-17-turn-6.gold.txt,"Alright, let me look.",alright let me look
en-US,conv-17-turn-7.gold.txt,Let's see. Okay. I found it. It's John dot Brown at email dot com.,let us see okay i found it it is john dot brown at email dot com
en-US,conv-17-turn-8.gold.txt,"I think it's, is it my wife's? Hold on. Let me see. Let me see. Okay. 1 2 1 2 1 2 3 4 5 6 7.",i think it is is it my wifes hold on let me see let me see okay one two one two one two three four five six seven
en-US,conv-17-turn-9.gold.txt,"Yeah. Actually, do the email again. I just wanna make sure it's correct.",yeah actually do the email again i just want to make sure it is correct
en-US,conv-18-turn-0.gold.txt,Yeah. This is John Brown and I would be interested in getting some financial information.,yeah this is john brown and i would be interested in getting some financial information
en-US,conv-18-turn-1.gold.txt,Repeat it?,repeat it
en-US,conv-18-turn-10.gold.txt,"Yes, I need help with my account. I'd like to know what my current credit limit is.",yes i need help with my account i would like to know what my current credit limit is
en-US,conv-18-turn-11.gold.txt,"That would be wonderful, please.",that would be wonderful please
en-US,conv-18-turn-12.gold.txt,Can you tell me about credit limit changes?,can you tell me about credit limit changes
en-US,conv-18-turn-13.gold.txt,Yes.,yes
en-US,conv-18-turn-14.gold.txt,Everything's fine.,everything is fine
en-US,conv-18-turn-15.gold.txt,"No, thank you.",no thank you
en-US,conv-18-turn-16.gold.txt,"You too, bye.",you too bye
en-US,conv-18-turn-2.gold.txt,C N 8 7 8. I need you to repeat.,c n eight seven eight i need you to repeat
en-US,conv-18-turn-3.gold.txt,The code is C N 8 7 8 5 5 4 7.,the code is c n eight seven eight five five four seven
en-US,conv-18-turn-4.gold.txt,John Brown.,john brown
en-US,conv-18-turn-5.gold.txt,John dot Brown at email dot com.,john dot brown at email dot com
en-US,conv-18-turn-6.gold.txt,My phone number is I don't know.,my phone number is i do not know
en-US,conv-18-turn-7.gold.txt,"My home address is 1 2 3 Main Street apartment 4, Anytown, California 9 0 2 1 0.",my home address is one two three main street apartment four anytown california nine zero two one zero
en-US,conv-18-turn-8.gold.txt,Yes.,yes
en-US,conv-18-turn-9.gold.txt,"Well, what I'm trying to find out is whether or not I want to use Bitcoin or something else for cryptocurrency investing.",well what i am trying to find out is whether or not i want to use bitcoin or something else for cryptocurrency investing
