locale,filename,raw_gold,normalized_gold
vi-VN,conv-34-turn-1.gold.txt,C N 2 8 1.,c n hai tám một
vi-VN,conv-34-turn-10.gold.txt,"Thế anh chị cho em xin mã theo dõi đơn hàng với ạ, để cho em chủ động kiểm tra.",thế anh chị cho em xin mã theo dõi đơn hàng với để cho em chủ động kiểm tra
vi-VN,conv-34-turn-11.gold.txt,Nếu thẻ bị gửi chậm thì ngân hàng có cách nào hỗ trợ tạm thời như là cấp thẻ ảo hay là hình thức thay thế không ạ? Anh chị giới thiệu giúp em để em cân nhắc với.,nếu thẻ bị gửi chậm thì ngân hàng có cách nào hỗ trợ tạm thời như là cấp thẻ ảo hay là hình thức thay thế không anh chị giới thiệu giúp em để em cân nhắc với
vi-VN,conv-34-turn-2.gold.txt,Tên của mình là Trần Thu.,tên của mình là trần thu
vi-VN,conv-34-turn-3.gold.txt,Email là minh chấm trần a còng Gmail chấm com.,email là minh chấm trần a còng gmail chấm com
vi-VN,conv-34-turn-4.gold.txt,Cộng 8 4 9 1 1 2 3 4 5 6 7 8.,cộng tám mươi bốn chín một một hai ba bốn năm sáu bảy tám
vi-VN,conv-34-turn-5.gold.txt,"Đầu tiên, em muốn hỏi về việc tăng hạn mức thẻ tín dụng của em, tại vì dạo gần đây nhu cầu của em có tăng. Chi tiêu công việc, đi lại với một số khoản thanh toán lớn nên em muốn xem liệu hạn mức có thể được nâng lên hay không. Anh chị giúp em kiểm tra xem thẻ của em có nằm trong diện được xét tăng hạn mức không ạ?",đầu tiên em muốn hỏi về việc tăng hạn mức thẻ tín dụng của em tại vì dạo gần đây nhu cầu của em có tăng chi tiêu công việc đi lại với một số khoản thanh toán lớn nên em muốn xem liệu hạn mức có thể được nâng lên hay không anh chị giúp em kiểm tra xem thẻ của em có nằm trong diện được xét tăng hạn mức không ạ
vi-VN,conv-34-turn-6.gold.txt,Vâng ạ.,vâng ạ
vi-VN,conv-34-turn-7.gold.txt,Thế em muốn xin bản sao sao kê hoặc là hóa đơn kỳ gần nhất của thẻ tín dụng được không ạ? Tại vì hiện tại em đang tổng hợp lại một vài chi tiêu của vài tháng gần đây nên cần bản sao kê mới nhất để theo dõi cho chính xác.,thế em muốn xin bản sao sao kê hoặc là hóa đơn kỳ gần nhất của thẻ tín dụng được không tại vì hiện tại em đang tổng hợp lại một vài chi tiêu của vài tháng gần đây nên cần bản sao kê mới nhất để theo dõi cho chính xác
vi-VN,conv-34-turn-8.gold.txt,Bạn gửi cho em giúp cái email đã đăng ký với ngân hàng hoặc là nếu có cách nào trực tiếp trên app thì giúp cho em để lần sau em chủ động thao tác hơn nha.,bạn gửi cho em giúp cái email đã đăng ký với ngân hàng hoặc là nếu có cách nào trực tiếp trên app thì giúp cho em để lần sau em chủ động thao tác hơn nha
vi-VN,conv-34-turn-9.gold.txt,Em có yêu cầu phát hành thẻ mới trước đó nên em muốn hỏi xem là thẻ của em đã được xử lý đến đâu rồi? Anh chị kiểm tra giúp em xem thẻ của em đã được phát hành chưa và đã gửi đi chưa? Được vận chuyển chưa hay vẫn đang chờ xét duyệt ấy ạ?,em có yêu cầu phát hành thẻ mới trước đó nên em muốn hỏi xem là thẻ của em đã được xử lý đến đâu rồi anh chị kiểm tra giúp em xem thẻ của em đã được phát hành chưa và đã gửi đi chưa được vận chuyển chưa hay vẫn đang chờ xét duyệt ấy ạ
vi-VN,conv-35-turn-0.gold.txt,Tôi gọi để được hỗ trợ một số thông tin liên quan đến thẻ tín dụng của tôi.,tôi gọi để được hỗ trợ một số thông tin liên quan đến thẻ tín dụng của tôi
vi-VN,conv-35-turn-1.gold.txt,C N 6 1 0 0.,c n sáu một không không
vi-VN,conv-35-turn-10.gold.txt,Alo.,alo
vi-VN,conv-35-turn-11.gold.txt,Alo.,alo
vi-VN,conv-35-turn-2.gold.txt,C N 6 1 0.,c n sáu một không
vi-VN,conv-35-turn-3.gold.txt,C N 6 1 9.,c n sáu một chín
vi-VN,conv-35-turn-4.gold.txt,Tên của tôi là Trần Thu.,tên của tôi là trần thu
vi-VN,conv-35-turn-5.gold.txt,Email của tôi là thu chấm trần a còng Gmail chấm com.,email của tôi là thu chấm trần a còng gmail chấm com
vi-VN,conv-35-turn-6.gold.txt,Đúng rồi ạ.,đúng rồi ạ
vi-VN,conv-35-turn-7.gold.txt,Cộng 8 4 9 1 1 2 3 4 5 6 7 8.,cộng tám mươi bốn chín một một hai ba bốn năm sáu bảy tám
vi-VN,conv-35-turn-8.gold.txt,Cộng 8 4 9 1 1 2 3 4 5 6 7 8.,cộng tám mươi bốn chín một một hai ba bốn năm sáu bảy tám
vi-VN,conv-35-turn-9.gold.txt,"Trước tiên, tôi muốn được tư vấn về việc tăng hạn mức thẻ tín dụng. Gần đây, nhu cầu chi tiêu và thanh toán của tôi có tăng. Vì vậy nên tôi muốn xem xét điều kiện để nâng hạn mức nhằm sử dụng thẻ thuận tiện hơn. Bạn thử kiểm tra giúp tôi xem là các thẻ của tôi có đủ điều kiện để xem xét tăng hạn mức không. Nếu mà cần cung cấp các giấy tờ như là sao kê lương hay là chứng minh thu nhập, hợp đồng lao động hay là bất kỳ cái hồ sơ nào khác thì bạn hướng dẫn tôi để tôi chuẩn bị đầy đủ nhá. Ngoài ra, tôi cũng mong bạn thông tin về cái thời gian dự kiến xét duyệt, quy trình nội bộ với các lưu ý quan trọng khi thực hiện nâng hạn mức.",trước tiên tôi muốn được tư vấn về việc tăng hạn mức thẻ tín dụng gần đây nhu cầu chi tiêu và thanh toán của tôi có tăng vì vậy nên tôi muốn xem xét điều kiện để nâng hạn mức nhằm sử dụng thẻ thuận tiện hơn bạn thử kiểm tra giúp tôi xem là các thẻ của tôi có đủ điều kiện để xem xét tăng hạn mức không nếu mà cần cung cấp các giấy tờ như là sao kê lương hay là chứng minh thu nhập hợp đồng lao động hay là bất kỳ cái hồ sơ nào khác thì bạn hướng dẫn tôi để tôi chuẩn bị đầy đủ nhá ngoài ra tôi cũng mong bạn thông tin về cái thời gian dự kiến xét duyệt quy trình nội bộ với các lưu ý quan trọng khi thực hiện nâng hạn mức
vi-VN,conv-36-turn-0.gold.txt,Chào Anna. Tôi gọi để xin hỗ trợ một số thông tin liên quan đến thẻ tín dụng của tôi.,chào anna tôi gọi để xin hỗ trợ một số thông tin liên quan đến thẻ tín dụng của tôi
vi-VN,conv-36-turn-1.gold.txt,C N 8 2 7.,c n tám hai bảy
vi-VN,conv-36-turn-10.gold.txt,Thế làm thế nào để tôi có được bản sao sao kê hoặc là hóa đơn mới nhất của thẻ tín dụng vậy?,thế làm thế nào để tôi có được bản sao sao kê hoặc là hóa đơn mới nhất của thẻ tín dụng vậy
vi-VN,conv-36-turn-11.gold.txt,"Tôi có yêu cầu phát hành thẻ mới, cái thẻ thay thế ấy. Muốn kiểm tra tình trạng xử lý. Bạn cho tôi biết là thẻ đã được phát hành chưa? Đã được gửi đi chưa?",tôi có yêu cầu phát hành thẻ mới cái thẻ thay thế ấy muốn kiểm tra tình trạng xử lý bạn cho tôi biết là thẻ đã được phát hành chưa đã được gửi đi chưa
vi-VN,conv-36-turn-12.gold.txt,Nếu mà thẻ gửi đi bị chậm thì ngân hàng có phương án hỗ trợ thẻ tạm thời nào để tôi thuận tiện trong công việc không?,nếu mà thẻ gửi đi bị chậm thì ngân hàng có phương án hỗ trợ thẻ tạm thời nào để tôi thuận tiện trong công việc không
vi-VN,conv-36-turn-2.gold.txt,Tên của tôi là Trần Thu.,tên của tôi là trần thu
vi-VN,conv-36-turn-3.gold.txt,Email của tôi là thu chấm trần a còng Gmail chấm com.,email của tôi là thu chấm trần a còng gmail chấm com
vi-VN,conv-36-turn-4.gold.txt,Đúng rồi.,đúng rồi
vi-VN,conv-36-turn-5.gold.txt,Cộng 8 4 9 1 1 2 3 4 5 6 7 8.,cộng tám mươi bốn chín một một hai ba bốn năm sáu bảy tám
vi-VN,conv-36-turn-6.gold.txt,Cộng 8 4 9 1 1 2 3 4 5 6 7 8.,cộng tám mươi bốn chín một một hai ba bốn năm sáu bảy tám
vi-VN,conv-36-turn-7.gold.txt,Tôi muốn được tư vấn về việc tăng hạn mức của thẻ tín dụng. Tôi muốn hỏi điều kiện để nâng hạn mức nhằm sử dụng thẻ thuận tiện hơn là gì?,tôi muốn được tư vấn về việc tăng hạn mức của thẻ tín dụng tôi muốn hỏi điều kiện để nâng hạn mức nhằm sử dụng thẻ thuận tiện hơn là gì
vi-VN,conv-36-turn-8.gold.txt,Tôi cần cung cấp giấy tờ gì để được nâng hạn mức thẻ tín dụng nhỉ?,tôi cần cung cấp giấy tờ gì để được nâng hạn mức thẻ tín dụng nhỉ
vi-VN,conv-36-turn-9.gold.txt,Nhanh giúp tôi.,nhanh giúp tôi
vi-VN,conv-37-turn-0.gold.txt,Chào Anna. Tôi muốn trao đổi về việc tăng hạn mức của thẻ tín dụng.,chào anna tôi muốn trao đổi về việc tăng hạn mức của thẻ tín dụng
vi-VN,conv-37-turn-1.gold.txt,Sẵn sàng.,sẵn sàng
vi-VN,conv-37-turn-10.gold.txt,"Bạn kiểm tra giúp tôi, điều kiện hiện tại có đủ để tăng hạn mức không?",bạn kiểm tra giúp tôi điều kiện hiện tại có đủ để tăng hạn mức không
vi-VN,conv-37-turn-11.gold.txt,Nhanh giúp tôi.,nhanh giúp tôi
vi-VN,conv-37-turn-12.gold.txt,Thế thì cần những điều kiện gì?,thế thì cần những điều kiện gì
vi-VN,conv-37-turn-13.gold.txt,Tôi muốn nhận bản sao sao kê hoặc hóa đơn mới nhất của thẻ tín dụng. Bạn giúp tôi gửi qua email đã đăng ký nhé!,tôi muốn nhận bản sao sao kê hoặc hóa đơn mới nhất của thẻ tín dụng bạn giúp tôi gửi qua email đã đăng ký nhé
vi-VN,conv-37-turn-14.gold.txt,"Tôi đã đăng ký phát hành thẻ mới, thẻ thay thế ấy. Tôi muốn kiểm tra tình trạng xử lý của thẻ như thế nào rồi. Bạn có thể kiểm tra với thông báo giúp tôi thẻ đã được phát hành chưa? Đã được chuyển đi chưa? Và nếu có mã vận chuyển thì cho tôi biết để theo dõi.",tôi đã đăng ký phát hành thẻ mới thẻ thay thế ấy tôi muốn kiểm tra tình trạng xử lý của thẻ như thế nào rồi bạn có thể kiểm tra với thông báo giúp tôi thẻ đã được phát hành chưa đã được chuyển đi chưa và nếu có mã vận chuyển thì cho tôi biết để theo dõi
vi-VN,conv-37-turn-15.gold.txt,Thẻ có đang bị chậm hay có vấn đề trong quá trình giao không ạ? Nếu có thì cho tôi xin phương án hỗ trợ tạm thời như là sử dụng thẻ ảo hay là các giải pháp thay thế để tôi không bị gián đoạn trong việc thanh toán.,thẻ có đang bị chậm hay có vấn đề trong quá trình giao không nếu có thì cho tôi xin phương án hỗ trợ tạm thời như là sử dụng thẻ ảo hay là các giải pháp thay thế để tôi không bị gián đoạn trong việc thanh toán
vi-VN,conv-37-turn-2.gold.txt,Mã của tôi là gì?,mã của tôi là gì
vi-VN,conv-37-turn-3.gold.txt,C N 3 0 0.,c n ba không không
vi-VN,conv-37-turn-4.gold.txt,Tên của tôi là Trần Thu.,tên của tôi là trần thu
vi-VN,conv-37-turn-5.gold.txt,Email là thu chấm trần a còng Gmail chấm com.,email là thu chấm trần a còng gmail chấm com
vi-VN,conv-37-turn-6.gold.txt,Cộng 8 4 9 1 1 2 3 4 5 6 7 8.,cộng tám mươi bốn chín một một hai ba bốn năm sáu bảy tám
vi-VN,conv-37-turn-7.gold.txt,Số điện thoại là cộng 8 4 9 1 1 2 3 4 5 6 7 8.,số điện thoại là cộng tám mươi bốn chín một một hai ba bốn năm sáu bảy tám
vi-VN,conv-37-turn-8.gold.txt,"Tôi ở số 1 2 3 đường Lê Lợi, Thành phố Hồ Chí Minh, Việt Nam.",tôi ở số một hai ba đường lê lợi thành phố hồ chí minh việt nam
vi-VN,conv-37-turn-9.gold.txt,Sẵn sàng.,sẵn sàng
vi-VN,conv-38-turn-0.gold.txt,Tôi muốn.,tôi muốn
vi-VN,conv-38-turn-1.gold.txt,Tôi có yêu cầu làm thẻ mới và muốn biết hiện trạng bây giờ như thế nào.,tôi có yêu cầu làm thẻ mới và muốn biết hiện trạng bây giờ như thế nào
vi-VN,conv-38-turn-10.gold.txt,Đúng rồi. Vui lòng hỗ trợ.,đúng rồi vui lòng hỗ trợ
vi-VN,conv-38-turn-11.gold.txt,Số điện thoại là cộng 84 9 1 1 2 3 4 5 6 7 8.,số điện thoại là cộng tám mươi bốn chín một một hai ba bốn năm sáu bảy tám
vi-VN,conv-38-turn-12.gold.txt,Đúng rồi. Đúng rồi.,đúng rồi đúng rồi
vi-VN,conv-38-turn-13.gold.txt,Rồi. OK.,rồi okay
vi-VN,conv-38-turn-14.gold.txt,Bạn đã kiểm tra xong chưa?,bạn đã kiểm tra xong chưa
vi-VN,conv-38-turn-15.gold.txt,Tôi có thể được nhận thẻ tạm không? Tôi muốn sử dụng thẻ tạm.,tôi có thể được nhận thẻ tạm không tôi muốn sử dụng thẻ tạm
vi-VN,conv-38-turn-16.gold.txt,Đúng vậy.,đúng vậy
vi-VN,conv-38-turn-17.gold.txt,Muốn. Vui lòng cho gặp nhận viên hỗ trợ trực tiếp.,muốn vui lòng cho gặp nhận viên hỗ trợ trực tiếp
vi-VN,conv-38-turn-18.gold.txt,Cảm ơn. Cảm ơn.,cảm ơn cảm ơn
vi-VN,conv-38-turn-19.gold.txt,Được. Được. Cảm ơn.,được được cảm ơn
vi-VN,conv-38-turn-2.gold.txt,OK.,okay
vi-VN,conv-38-turn-20.gold.txt,"À, không. Cảm ơn.",không cảm ơn
vi-VN,conv-38-turn-3.gold.txt,Sẵn sàng. Vui lòng đọc lại giùm.,sẵn sàng vui lòng đọc lại giùm
vi-VN,conv-38-turn-4.gold.txt,C N 6 9 5.,c n sáu chín năm
vi-VN,conv-38-turn-5.gold.txt,Đúng rồi. Đúng rồi. C N 6 9 5.,đúng rồi đúng rồi c n sáu chín năm
vi-VN,conv-38-turn-6.gold.txt,Tên là Trần Minh.,tên là trần minh
vi-VN,conv-38-turn-7.gold.txt,Email là minh chấm trần a còng email chấm com.,email là minh chấm trần a còng email chấm com
vi-VN,conv-38-turn-8.gold.txt,Chính xác.,chính xác
vi-VN,conv-38-turn-9.gold.txt,Đúng rồi. Đúng rồi.,đúng rồi đúng rồi
vi-VN,conv-39-turn-0.gold.txt,Chào Anna. Tôi muốn hỏi một chút về vấn đề này. Tôi muốn tăng hạn mức cao hơn cho thẻ tín dụng của mình.,chào anna tôi muốn hỏi một chút về vấn đề này tôi muốn tăng hạn mức cao hơn cho thẻ tín dụng của mình
vi-VN,conv-39-turn-1.gold.txt,Ừ. Cảm ơn bạn. Bạn xem lại hộ mình nhá.,cảm ơn bạn bạn xem lại hộ mình nhá
vi-VN,conv-39-turn-10.gold.txt,Cảm ơn bạn nhiều nhá. Mình kết thúc cuộc gọi ở đây nhá.,cảm ơn bạn nhiều nhá mình kết thúc cuộc gọi ở đây nhá
vi-VN,conv-39-turn-11.gold.txt,Cảm ơn Anna. Bye Anna.,cảm ơn anna bye anna
vi-VN,conv-39-turn-12.gold.txt,OK. Cảm ơn Anna nhiều.,okay cảm ơn anna nhiều
vi-VN,conv-39-turn-2.gold.txt,Có. Đọc lại cho mình để mình ghi với.,có đọc lại cho mình để mình ghi với
vi-VN,conv-39-turn-3.gold.txt,OK. Mình nghe thấy rồi. C N 6 9 0. Cảm ơn Anna.,okay mình nghe thấy rồi c n sáu chín không cảm ơn anna
vi-VN,conv-39-turn-4.gold.txt,OK. Mình đọc thông tin của mình nhá. Mình tên là Trần Minh. Mình có phải cung cấp thêm thông tin gì khác nữa không?,okay mình đọc thông tin của mình nhá mình tên là trần minh mình có phải cung cấp thêm thông tin gì khác nữa không
vi-VN,conv-39-turn-5.gold.txt,Mình đọc nhá. Địa chỉ email của mình là minh chấm trần a còng email chấm com. Tất cả đều viết không dấu.,mình đọc nhá địa chỉ email của mình là minh chấm trần a còng email chấm com tất cả đều viết không dấu
vi-VN,conv-39-turn-6.gold.txt,"OK. Số điện thoại của mình là, mình đọc đầy đủ nhá, cộng 8 4 9 1 1 2 3 4 5 6 7 8. Anna nghe được không?",okay số điện thoại của mình là mình đọc đầy đủ nhé cộng tám mươi bốn chín một một hai ba bốn năm sáu bảy tám anna nghe được không
vi-VN,conv-39-turn-7.gold.txt,Đúng rồi Anna. Chuẩn. Cảm ơn bạn nhá.,đúng rồi anna chuẩn cảm ơn bạn nhá
vi-VN,conv-39-turn-8.gold.txt,Ờ rồi. Mình cảm ơn. Vậy mình sẽ chờ email của bên bạn Anna.,rồi mình cảm ơn vậy mình sẽ chờ email của bên bạn anna
vi-VN,conv-39-turn-9.gold.txt,À.,
vi-VN,conv-4-turn-0.gold.txt,"Chào Anna, tôi là.",chào anna tôi là
vi-VN,conv-4-turn-1.gold.txt,Mình muốn trao đổi một chút. Mình muốn tăng hạn mức thẻ tín dụng.,mình muốn trao đổi một chút mình muốn tăng hạn mức thẻ tín dụng
vi-VN,conv-4-turn-10.gold.txt,Ờ đúng rồi bạn ạ.,đúng rồi bạn ạ
vi-VN,conv-4-turn-11.gold.txt,Rồi. Mình sẵn sàng rồi.,rồi mình sẵn sàng rồi
vi-VN,conv-4-turn-12.gold.txt,"Rồi. Cảm ơn bạn. Đây, để mình xem nhận thông báo được chưa nhá. Cảm ơn Anna.",rồi cảm ơn bạn đây để mình xem nhận thông báo được chưa nhá cảm ơn anna
vi-VN,conv-4-turn-13.gold.txt,"Rồi, OK bạn. Thank you nha.",rồi okay bạn thank you nha
vi-VN,conv-4-turn-14.gold.txt,Cảm ơn bạn. Chúc Anna một ngày vui vẻ. Anna kết thúc cuộc gọi cho mình nhá. Mình cảm ơn.,cảm ơn bạn chúc anna một ngày vui vẻ anna kết thúc cuộc gọi cho mình nhá mình cảm ơn
vi-VN,conv-4-turn-15.gold.txt,"OK. Thank you, Anna.",okay cảm ơn anna
vi-VN,conv-4-turn-16.gold.txt,OK. Bye bye.,okay bye bye
vi-VN,conv-4-turn-2.gold.txt,C N 7 8 3. Rồi. Mình nghe thấy rồi bạn ơi.,c n bảy tám ba rồi mình nghe thấy rồi bạn ơi
vi-VN,conv-4-turn-3.gold.txt,Ờ.,
vi-VN,conv-4-turn-4.gold.txt,Tên đầy đủ của mình là.,tên đầy đủ của mình là
vi-VN,conv-4-turn-5.gold.txt,Tên đầy đủ của tôi là Trần Minh.,tên đầy đủ của tôi là trần minh
vi-VN,conv-4-turn-6.gold.txt,Đúng rồi bạn ạ. Chuẩn rồi Anna ơi.,đúng rồi bạn ạ chuẩn rồi anna ơi
vi-VN,conv-4-turn-7.gold.txt,Địa chỉ email là minh chấn trần a còng email chấm com.,địa chỉ email là minh chấn trần a còng email chấm com
vi-VN,conv-4-turn-8.gold.txt,Đúng rồi Anna.,đúng rồi anna
vi-VN,conv-4-turn-9.gold.txt,Số điện thoại của mình là cộng 8 4 9 1 1 2 3 4 5 6 7 8.,số điện thoại của mình là cộng tám mươi bốn chín một một hai ba bốn năm sáu bảy tám
vi-VN,conv-40-turn-0.gold.txt,Xin chào. Tôi gọi tới muốn xin gia tăng hạn mức thẻ tín dụng.,xin chào tôi gọi tới muốn xin gia tăng hạn mức thẻ tín dụng
vi-VN,conv-40-turn-1.gold.txt,OK.,okay
vi-VN,conv-40-turn-10.gold.txt,Số điện thoại chưa chính xác. Số điện thoại là cộng 84.,số điện thoại chưa chính xác số điện thoại là cộng tám mươi bốn
vi-VN,conv-40-turn-11.gold.txt,9 1.,chín một
vi-VN,conv-40-turn-12.gold.txt,Cộng 84 9 1 1 2 3 4 5 6 7 8.,cộng tám mươi bốn chín một một hai ba bốn năm sáu bảy tám
vi-VN,conv-40-turn-13.gold.txt,"Chưa đúng, thiếu một số 1. Tức là cộng 84 9 1 rồi 1 2 3 4 5 6 7 8.",chưa đúng thiếu một số một tức là cộng tám mươi bốn chín một rồi một hai ba bốn năm sáu bảy tám
vi-VN,conv-40-turn-14.gold.txt,Không phải. Là cộng 84.,không phải là cộng tám mươi bốn
vi-VN,conv-40-turn-15.gold.txt,9 1.,chín một
vi-VN,conv-40-turn-16.gold.txt,Không đúng. Số điện thoại chính xác là cộng 84 9 1 1 2 3 4 5 6 7 8.,không đúng số điện thoại chính xác là cộng tám mươi bốn chín một một hai ba bốn năm sáu bảy tám
vi-VN,conv-40-turn-17.gold.txt,Sai rồi. Đọc nãy giờ mà không nghe được. Số điện thoại nghe cho kĩ nè. Cộng 84 9 1 1 2 3 4 5 6 7 8.,sai rồi đọc nãy giờ mà không nghe được số điện thoại nghe cho kĩ nè cộng tám mươi bốn chín một một hai ba bốn năm sáu bảy tám
vi-VN,conv-40-turn-18.gold.txt,Chưa chính xác. Chính xác phải là cộng 84 9 1 1 2 3 4 5 6 7 8.,chưa chính xác chính xác phải là cộng tám mươi bốn chín một một hai ba bốn năm sáu bảy tám
vi-VN,conv-40-turn-19.gold.txt,"OK. Địa chỉ liên lạc là 1 2 3 Lê Lợi, Hồ Chí Minh, Việt Nam. Zip code là 700000.",okay địa chỉ liên lạc là một hai ba lê lợi hồ chí minh việt nam zip code là bảy trăm nghìn
vi-VN,conv-40-turn-2.gold.txt,Bạn cần thông tin gì?,bạn cần thông tin gì
vi-VN,conv-40-turn-20.gold.txt,Đúng rồi.,đúng rồi
vi-VN,conv-40-turn-21.gold.txt,Vui lòng hướng dẫn tôi.,vui lòng hướng dẫn tôi
vi-VN,conv-40-turn-22.gold.txt,OK.,okay
vi-VN,conv-40-turn-23.gold.txt,Khoan đã. Tôi muốn hỏi là tôi cần những thông tin gì để có thể được tăng hạn mức?,khoan đã tôi muốn hỏi là tôi cần những thông tin gì để có thể được tăng hạn mức
vi-VN,conv-40-turn-24.gold.txt,OK. Cảm ơn.,okay cảm ơn
vi-VN,conv-40-turn-25.gold.txt,Muốn. Vui lòng giúp tôi với.,muốn vui lòng giúp tôi với
vi-VN,conv-40-turn-26.gold.txt,OK.,okay
vi-VN,conv-40-turn-27.gold.txt,Thôi được rồi. Cảm ơn.,thôi được rồi cảm ơn
vi-VN,conv-40-turn-3.gold.txt,C N 7 1 8.,c n bảy một tám
vi-VN,conv-40-turn-4.gold.txt,Tên đầy đủ là Trần Minh.,tên đầy đủ là trần minh
vi-VN,conv-40-turn-5.gold.txt,Email là minh chấm trần a còng email chấm com.,email là minh chấm trần a còng email chấm com
vi-VN,conv-40-turn-6.gold.txt,Số điện thoại là cộng 84 9 1 1 2 3 4 5 6 7 8.,số điện thoại là cộng tám mươi bốn chín một một hai ba bốn năm sáu bảy tám
vi-VN,conv-40-turn-7.gold.txt,Email thì đúng rồi nhưng mà cái số điện thoại thì bị sai. Số điện thoại phải là cộng 84.,email thì đúng rồi nhưng mà cái số điện thoại thì bị sai số điện thoại phải là cộng tám mươi bốn
vi-VN,conv-40-turn-8.gold.txt,Cộng 84 9 1 1 2 3 4 5 6 7 8.,cộng tám mươi bốn chín một một hai ba bốn năm sáu bảy tám
vi-VN,conv-40-turn-9.gold.txt,Số điện thoại chưa chính xác. Số điện thoại chính xác là cộng 84 9 1 1 2 3 4 5 6 7 8.,số điện thoại chưa chính xác số điện thoại chính xác là cộng tám mươi bốn chín một một hai ba bốn năm sáu bảy tám
vi-VN,conv-41-turn-0.gold.txt,Tôi muốn coi cái hóa đơn thanh toán gần nhất.,tôi muốn coi cái hóa đơn thanh toán gần nhất
vi-VN,conv-41-turn-1.gold.txt,"Xem hết luôn. Tiền, ngày gì. Xem hết luôn.",xem hết luôn tiền ngày gì xem hết luôn
vi-VN,conv-41-turn-10.gold.txt,Chưa phải. Số điện thoại là cộng 84 1 2. Xin đọc lại. Cộng 84 9 1 1 2 3 4 5 6 7 8.,chưa phải số điện thoại là cộng tám mươi bốn một hai xin đọc lại cộng tám mươi bốn chín một một hai ba bốn năm sáu bảy tám
vi-VN,conv-41-turn-11.gold.txt,Chưa. Số điện thoại chính xác phải là cộng 84 9 1 1 2 3 4 5 6 7 8.,chưa số điện thoại chính xác phải là cộng tám mươi bốn chín một một hai ba bốn năm sáu bảy tám
vi-VN,conv-41-turn-12.gold.txt,Chính xác rồi.,chính xác rồi
vi-VN,conv-41-turn-13.gold.txt,OK. Cảm ơn.,okay cảm ơn
vi-VN,conv-41-turn-14.gold.txt,Vậy muốn xem thì phải làm sao?,vậy muốn xem thì phải làm sao
vi-VN,conv-41-turn-15.gold.txt,"Cái này lần đầu, không biết. Hướng dẫn giùm.",cái này lần đầu không biết hướng dẫn giùm
vi-VN,conv-41-turn-16.gold.txt,Có. Vui lòng hướng dẫn.,có vui lòng hướng dẫn
vi-VN,conv-41-turn-17.gold.txt,Qua ứng dụng.,qua ứng dụng
vi-VN,conv-41-turn-18.gold.txt,Rồi.,rồi
vi-VN,conv-41-turn-19.gold.txt,Rồi. Vô hết rồi.,rồi vô hết rồi
vi-VN,conv-41-turn-2.gold.txt,Rồi.,rồi
vi-VN,conv-41-turn-20.gold.txt,Rồi ạ. Vui lòng hướng dẫn tiếp tục. Xin chào.,rồi ạ vui lòng hướng dẫn tiếp tục xin chào
vi-VN,conv-41-turn-21.gold.txt,Có một vài giao dịch bất thường. Tôi muốn tìm hiểu.,có một vài giao dịch bất thường tôi muốn tìm hiểu
vi-VN,conv-41-turn-22.gold.txt,"Ngày hôm qua, số tiền là 500000.",ngày hôm qua số tiền là năm trăm nghìn
vi-VN,conv-41-turn-23.gold.txt,"Ngày là ngày hôm qua, ngày 17 tháng 11. Còn cái chỗ cửa hàng thì không có để tên, không biết.",ngày là ngày hôm qua ngày mười bảy tháng mười một còn cái chỗ cửa hàng thì không có để tên không biết
vi-VN,conv-41-turn-24.gold.txt,"Đúng, nhưng mà tôi muốn nói chuyện với người sớm hơn, ngay bây giờ.",đúng nhưng mà tôi muốn nói chuyện với người sớm hơn ngay bây giờ
vi-VN,conv-41-turn-25.gold.txt,Thôi. Vậy thôi.,thôi vậy thôi
