locale,filename,raw_gold,normalized_gold
tr-TR,conv-29-turn-18.gold.txt,At email nokta com değil mi? Email nokta com.,at email nokta com değil mi email nokta com
tr-TR,conv-29-turn-19.gold.txt,Anlamıyor.,anlamıyor
tr-TR,conv-29-turn-2.gold.txt,Tabii. X R 0 1 12.,tabii x r sıfır bir on iki
tr-TR,conv-29-turn-20.gold.txt,"Gmail değil, email, email, email nokta com.",gmail değil email email email nokta com
tr-TR,conv-29-turn-21.gold.txt,"Dot diyor ya. Nokta com, nokta com, nokta com.",dot diyor ya nokta com nokta com nokta com
tr-TR,conv-29-turn-22.gold.txt,Evet.,evet
tr-TR,conv-29-turn-23.gold.txt,Email nokta com adresime.,email nokta com adresime
tr-TR,conv-29-turn-24.gold.txt,"At email nokta com adres, evet.",at email nokta com adres evet
tr-TR,conv-29-turn-25.gold.txt,Şu at mail dediğinizde mailin önünde E var değil mi?,şu at mail dediğinizde mailin önünde e var değil mi
tr-TR,conv-29-turn-26.gold.txt,Tamam. At email nokta com.,tamam at email nokta com
tr-TR,conv-29-turn-27.gold.txt,Tamam bekliyorum.,tamam bekliyorum
tr-TR,conv-29-turn-28.gold.txt,Tamam başka bir isteğim yok.,tamam başka bir isteğim yok
tr-TR,conv-29-turn-29.gold.txt,"Tamam teşekkür ederim, iyi günler.",tamam teşekkür ederim iyi günler
tr-TR,conv-29-turn-3.gold.txt,Tabii Zaynep Arslan.,tabii zaynep arslan
tr-TR,conv-29-turn-4.gold.txt,Rica ederim.,rica ederim
tr-TR,conv-29-turn-5.gold.txt,Tabii. Zaynep nokta Arslan at email nokta com.,tabii zaynep nokta arslan at email nokta com
tr-TR,conv-29-turn-6.gold.txt,Evet doğru ancak Zaynep ve Arslan arasında nokta işareti var.,evet doğru ancak zaynep ve arslan arasında nokta işareti var
tr-TR,conv-29-turn-7.gold.txt,Teşekkür ederim.,teşekkür ederim
tr-TR,conv-29-turn-8.gold.txt,Tabii ki. Artı 90 123 0 90 45 67.,tabii ki artı doksan bir yüz yirmi üç sıfır doksan kırk beş altmış yedi
tr-TR,conv-29-turn-9.gold.txt,"Teşekkür ederim. Email adresimde bir hata yok değil mi? Çünkü acil olarak ihtiyacım var o ekstreye, işlem yapacağım. Tekrar eder misiniz email adresimi lütfen?",teşekkür ederim email adresimde bir hata yok değil mi çünkü acil olarak ihtiyacım var o ekstreye işlem yapacağım tekrar eder misiniz email adresimi lütfen
tr-TR,conv-3-turn-0.gold.txt,"Merhaba, yeni bir kredi kartı başvurusunda bulunmak istiyorum. Yardımcı olabilir misiniz?",merhaba yeni bir kredi kartı başvurusunda bulunmak istiyorum yardımcı olabilir misiniz
tr-TR,conv-3-turn-1.gold.txt,C N 5 4 4. Doğru mudur?,c n beş dört dört doğru mudur
tr-TR,conv-3-turn-10.gold.txt,"Tabii, istiyorum.",tabii istiyorum
tr-TR,conv-3-turn-11.gold.txt,"Yok, teşekkür ederim, iyi günler.",yok teşekkür ederim iyi günler
tr-TR,conv-3-turn-2.gold.txt,C N 5 4 9. Doğru mudur?,c n beş dört dokuz doğru mudur
tr-TR,conv-3-turn-3.gold.txt,Ahmet Arslan.,ahmet arslan
tr-TR,conv-3-turn-4.gold.txt,Ahmet nokta Arslan at email nokta com.,ahmet nokta arslan at email nokta com
tr-TR,conv-3-turn-5.gold.txt,Artı 90 123 0 90 45 67.,artı doksan bir yüz yirmi üç sıfır doksan kırk beş altmış yedi
tr-TR,conv-3-turn-6.gold.txt,"Atatürk Caddesi numara 45 bölü 6, Kazım Karabekir Mahallesi, Üsküdar, İstanbul 34660 Türkiye.",atatürk caddesi numara kırk beş bölü altı kazım karabekir mahallesi üsküdar istanbul otuz dört bin altı yüz altmış türkiye
tr-TR,conv-3-turn-7.gold.txt,"Atatürk Caddesi numara 45 bölü 6, Kazım Karabekir Mahallesi, Üsküdar, İstanbul 34660 Türkiye.",atatürk caddesi numara kırk beş bölü altı kazım karabekir mahallesi üsküdar istanbul otuz dört bin altı yüz altmış türkiye
tr-TR,conv-3-turn-8.gold.txt,"Tabii, bekliyorum.",tabii bekliyorum
tr-TR,conv-3-turn-9.gold.txt,"Ne kadar ücret ödemem gerekiyor, kredi kartı başvuru sırasında?",ne kadar ücret ödemem gerekiyor kredi kartı başvuru sırasında
tr-TR,conv-30-turn-0.gold.txt,Günaydın Anna.,günaydın anna
tr-TR,conv-30-turn-1.gold.txt,"Ben yeni kredi kartı çıkartmıştım da, onu bekliyorum. Onun durumu ile alakalı bilgi almak istiyorum. Şu an nerede kartım?",ben yeni kredi kartı çıkartmıştım da onu bekliyorum onun durumu ile alakalı bilgi almak istiyorum şu an nerede kartım
tr-TR,conv-30-turn-2.gold.txt,"Evet, lütfen.",evet lütfen
tr-TR,conv-30-turn-3.gold.txt,Tekrarlıyorum. C E T 4 8 9.,tekrarlıyorum c e t dört sekiz dokuz
tr-TR,conv-30-turn-4.gold.txt,Yok ben anlayamadım. Bir önceki koddan farklıydı çünkü. Lütfen tekrar eder misiniz?,yok ben anlayamadım bir önceki koddan farklıydı çünkü lütfen tekrar eder misiniz
tr-TR,conv-30-turn-5.gold.txt,<foreign> dediğiniz ne?,dediğiniz ne
tr-TR,conv-30-turn-6.gold.txt,Yok.,yok
tr-TR,conv-30-turn-7.gold.txt,Bu ne ya?,bu ne ya
tr-TR,conv-31-turn-0.gold.txt,"Merhabalar, ben.",merhabalar ben
tr-TR,conv-31-turn-1.gold.txt,Ben yeni bir kredi kartı bekliyorum da onun durumu ile alakalı bilgi almak istiyordum.,ben yeni bir kredi kartı bekliyorum da onun durumu ile alakalı bilgi almak istiyordum
tr-TR,conv-31-turn-10.gold.txt,Telefon numaramı tekrar eder misiniz?,telefon numaramı tekrar eder misiniz
tr-TR,conv-31-turn-11.gold.txt,"Evet doğru, teşekkür ederim. Ne zaman gelecek peki?",evet doğru teşekkür ederim ne zaman gelecek peki
tr-TR,conv-31-turn-12.gold.txt,Şu anda yok. Teşekkür ederim. Eğer bir problem çıkarsa ben tekrar ararım zaten.,şu anda yok teşekkür ederim eğer bir problem çıkarsa ben tekrar ararım zaten
tr-TR,conv-31-turn-13.gold.txt,"Tamam. Tamam. Çok teşekkür ederim, iyi günler, hoşça kalın.",tamam tamam çok teşekkür ederim iyi günler hoşça kalın
tr-TR,conv-31-turn-14.gold.txt,"Hoşça kalın, iyi günler.",hoşça kalın iyi günler
tr-TR,conv-31-turn-2.gold.txt,Evet.,evet
tr-TR,conv-31-turn-3.gold.txt,"Evet, dinliyorum.",evet dinliyorum
tr-TR,conv-31-turn-4.gold.txt,C N 9 7 1 6.,c n dokuz yedi bir altı
tr-TR,conv-31-turn-5.gold.txt,Rica ederim.,rica ederim
tr-TR,conv-31-turn-6.gold.txt,Zeynep Arslan.,zeynep arslan
tr-TR,conv-31-turn-7.gold.txt,Zeynep nokta Arslan at email nokta com.,zeynep nokta arslan at email nokta com
tr-TR,conv-31-turn-8.gold.txt,Tabii. 0 90 123 0 90 45 67.,tabii sıfır doksan yüz yirmi üç sıfır doksan kırk beş altmış yedi
tr-TR,conv-31-turn-9.gold.txt,Evet.,evet
tr-TR,conv-32-turn-0.gold.txt,"Günaydın. Şimdi bana bir mesaj geldi şüpheli bir mesaj. Kredi kartınızdan işlem yapılmıştır diye. Yalnız bu işlem bana ait değil, bir kontrol edebilir misiniz hemen?",günaydın şimdi bana bir mesaj geldi şüpheli bir mesaj kredi kartınızdan işlem yapılmıştır diye yalnız bu işlem bana ait değil bir kontrol edebilir misiniz hemen
tr-TR,conv-32-turn-1.gold.txt,"Tabii, bekliyorum.",tabii bekliyorum
tr-TR,conv-32-turn-10.gold.txt,Rica ederim.,rica ederim
tr-TR,conv-32-turn-11.gold.txt,Zaynep Arslan.,zaynep arslan
tr-TR,conv-32-turn-12.gold.txt,"Tabii ki, hemen söylüyorum. 23 aralık.",tabii ki hemen söylüyorum yirmi üç aralık
tr-TR,conv-32-turn-13.gold.txt,1500 TL.,bin beş yüz tl
tr-TR,conv-32-turn-14.gold.txt,Migros'tan yapılmış.,migrostan yapılmış
tr-TR,conv-32-turn-15.gold.txt,Peki bu süreçte ne yapayım eğer kredi kartım çalınmışsa vesaire? Belki de çalındı. Kapatsak daha iyi olmaz mı kredi kartımı?,peki bu süreçte ne yapayım eğer kredi kartım çalınmışsa vesaire belki de çalındı kapatsak daha iyi olmaz mı kredi kartımı
tr-TR,conv-32-turn-16.gold.txt,Tamam. Tabii bekliyorum.,tamam tabii bekliyorum
tr-TR,conv-32-turn-17.gold.txt,Bekliyorum.,bekliyorum
tr-TR,conv-32-turn-18.gold.txt,Tamam.,tamam
tr-TR,conv-32-turn-19.gold.txt,Siz neden aktaramıyorsunuz şu anda? Neden şu an aktaramıyorsunuz? Yani.,siz neden aktaramıyorsunuz şu anda neden şu an aktaramıyorsunuz
tr-TR,conv-32-turn-2.gold.txt,Evet.,evet
tr-TR,conv-32-turn-20.gold.txt,Tamam da zaten çok zor bir şekilde bağlanılıyor zaten. Benim işlemim de çok acil. Lütfen aktarabilir misiniz siz?,tamam da zaten çok zor bir şekilde bağlanılıyor zaten benim işlemim de çok acil lütfen aktarabilir misiniz siz
tr-TR,conv-32-turn-21.gold.txt,"Tamam hoşça kalın, teşekkürler.",tamam hoşça kalın teşekkürler
tr-TR,conv-32-turn-22.gold.txt,İyi günler.,iyi günler
tr-TR,conv-32-turn-3.gold.txt,Y E 2 5 6 8.,y e iki beş altı sekiz
tr-TR,conv-32-turn-4.gold.txt,Zaynep Arslan.,zaynep arslan
tr-TR,conv-32-turn-5.gold.txt,"Tabii, Zaynep nokta Arslan at email nokta com.",tabii zaynep nokta arslan at email nokta com
tr-TR,conv-32-turn-6.gold.txt,Tabii. Artı 90.,tabii artı doksan
tr-TR,conv-32-turn-7.gold.txt,Tabii. Artı 90 123 0 90 45 67.,tabii artı doksan yüz yirmi üç sıfır doksan kırk beş altmış yedi
tr-TR,conv-32-turn-8.gold.txt,Tekrar edeyim mi?,tekrar edeyim mi
tr-TR,conv-32-turn-9.gold.txt,Tabii. Artı 90 123 0 90 45 67.,tabii artı doksan yüz yirmi üç sıfır doksan kırk beş altmış yedi
tr-TR,conv-33-turn-0.gold.txt,"Merhabalar, yeni bir kredi kartı aldım da şifre istiyorum.",merhabalar yeni bir kredi kartı aldım da şifre istiyorum
tr-TR,conv-33-turn-1.gold.txt,Evet.,evet
tr-TR,conv-33-turn-10.gold.txt,Tabii. 0 90 123 0 90 45 67.,tabii sıfır doksan yüz yirmi üç sıfır doksan kırk beş altmış yedi
tr-TR,conv-33-turn-11.gold.txt,45 67.,kırk beş altmış yedi
tr-TR,conv-33-turn-12.gold.txt,Kartım teslim edildi ama? Şu an elimde.,kartım teslim edildi ama şu an elimde
tr-TR,conv-33-turn-13.gold.txt,Tabii.,tabii
tr-TR,conv-33-turn-2.gold.txt,Lütfen bir daha tekrar edebilir misiniz yavaş bir şekilde?,lütfen bir daha tekrar edebilir misiniz yavaş bir şekilde
tr-TR,conv-33-turn-3.gold.txt,"Evet, bekliyorum.",evet bekliyorum
tr-TR,conv-33-turn-4.gold.txt,V M 8 9 0.,v m sekiz dokuz sıfır
tr-TR,conv-33-turn-5.gold.txt,V M 8 9 0 4.,v m sekiz dokuz sıfır dört
tr-TR,conv-33-turn-6.gold.txt,Rica ederim.,rica ederim
tr-TR,conv-33-turn-7.gold.txt,Zeynep Arslan.,zeynep arslan
tr-TR,conv-33-turn-8.gold.txt,"Tabii. Zeynep nokta Arslan at, pardon çok özür dilerim tekrarlayacağım.",tabii zeynep nokta arslan at pardon çok özür dilerim tekrarlayacağım
tr-TR,conv-33-turn-9.gold.txt,Zeynep nokta Arslan at email nokta com.,zeynep nokta arslan at email nokta com
tr-TR,conv-34-turn-0.gold.txt,"Anna Hanım merhabalar, öncelikle teşekkür ediyorum. Ben kredi kartı limitinin artırılmasını talep ediyorum. Bu konuda yardımcı olabilir misiniz?",anna hanım merhabalar öncelikle teşekkür ediyorum ben kredi kartı limitinin artırılmasını talep ediyorum bu konuda yardımcı olabilir misiniz
tr-TR,conv-34-turn-1.gold.txt,"Bir saniye, notlarımı açıyorum.",bir saniye notlarımı açıyorum
tr-TR,conv-34-turn-10.gold.txt,"Hayır e-posta adresimin sonu email nokta com, telefon numaramın sonu ise 45 67.",hayır e posta adresimin sonu email nokta com telefon numaramın sonu ise kırk beş altmış yedi
tr-TR,conv-34-turn-11.gold.txt,Doğrudur.,doğrudur
tr-TR,conv-34-turn-12.gold.txt,"Olur, gelsin.",olur gelsin
tr-TR,conv-34-turn-13.gold.txt,Teşekkür ediyorum Anna Hanım.,teşekkür ediyorum anna hanım
tr-TR,conv-34-turn-14.gold.txt,İyi günler.,iyi günler
tr-TR,conv-34-turn-2.gold.txt,"Tamamdır, şu anda hazırım. Bana kodu okuyabilir misiniz?",tamamdır şu anda hazırım bana kodu okuyabilir misiniz
tr-TR,conv-34-turn-3.gold.txt,Lütfen kodlayarak söyler misiniz? Ben kaçırdım da.,lütfen kodlayarak söyler misiniz ben kaçırdım da
tr-TR,conv-34-turn-4.gold.txt,N D 2 7 2 2. Doğru mudur?,n d iki yedi iki iki doğru mudur
tr-TR,conv-34-turn-5.gold.txt,"Yani Niğde, Denizli, 2 7 2 2.",niğde denizli iki yedi iki iki
tr-TR,conv-34-turn-6.gold.txt,Adım Zaynep.,adım zaynep
tr-TR,conv-34-turn-7.gold.txt,Zaynep Arslan at email nokta com.,zaynep arslan at email nokta com
tr-TR,conv-34-turn-8.gold.txt,"Bir saniye, hemen veriyorum.",bir saniye hemen veriyorum
tr-TR,conv-34-turn-9.gold.txt,"E-posta adresim, Zaynep nokta Arslan at email nokta com. Telefon numaram 0 123 0 90 45 67.",e posta adresim zaynep nokta arslan at email nokta com telefon numaram sıfır bir iki üç sıfır doksan beş kırk yedi
tr-TR,conv-35-turn-0.gold.txt,"Anna Hanım merhabalar, öncelikle teşekkür ediyorum. Ben kartımı kaybettim, acaba bana yardımcı olabilir misiniz? Kartımı iptal ettirmem gerekiyor herhalde.",anna hanım merhabalar öncelikle teşekkür ediyorum ben kartımı kaybettim acaba bana yardımcı olabilir misiniz kartımı iptal ettirmem gerekiyor herhalde
tr-TR,conv-35-turn-1.gold.txt,"Tabii, not alayım. Öncelikle notlarımı açayım bir saniye.",tabii not alayım öncelikle notlarımı açayım bir saniye
tr-TR,conv-35-turn-10.gold.txt,Yok teşekkür ederim.,yok teşekkür ederim
tr-TR,conv-35-turn-11.gold.txt,"Teşekkürler, kolay gelsin.",teşekkürler kolay gelsin
tr-TR,conv-35-turn-2.gold.txt,Size yetişemedim. Tekrar eder misiniz?,size yetişemedim tekrar eder misiniz
tr-TR,conv-35-turn-3.gold.txt,"Yalova, Manisa, 7 6 1 3 3. Doğru mudur?",yalova manisa yedi altı bir üç üç doğru mudur
tr-TR,conv-35-turn-4.gold.txt,İsmim Zeynep Arslan.,ismim zeynep arslan
tr-TR,conv-35-turn-5.gold.txt,"E-posta adresim, Zeynep nokta Arslan at email nokta com.",e posta adresim zeynep nokta arslan at email nokta com
tr-TR,conv-35-turn-6.gold.txt,"Tabii, hemen ileteyim bir saniye. Telefon numaram artı 90 123 0 90 45 67.",tabii hemen ileteyim bir saniye telefon numaram artı doksan bir iki üç sıfır doksan kırk beş altmış yedi
tr-TR,conv-35-turn-7.gold.txt,E-posta adresim ve numaramda yanlışlık var. E-posta adresim Zeynep nokta Arslan at email nokta com. Numaram ise 90 123 0 90 45 67.,e posta adresim ve numaramda yanlışlık var e posta adresim zeynep nokta arslan at email nokta com numaram ise doksan bir yüz yirmi üç sıfır doksan kırk beş altmış yedi
tr-TR,conv-35-turn-8.gold.txt,"Evet, evet doğrudur.",evet evet doğrudur
tr-TR,conv-35-turn-9.gold.txt,Tamam bekliyorum.,tamam bekliyorum
tr-TR,conv-36-turn-0.gold.txt,"Anna Hanım merhabalar. Şimdi şöyle, ben kredi kartıma dair ekstremin bir kopyasını istiyorum. Ya da ekstremin bir dökümünü istiyorum daha doğrusu.",anna hanım merhabalar şimdi ben kredi kartıma dair ekstremin bir kopyasını istiyorum ya da ekstremin bir dökümünü istiyorum daha doğrusu
tr-TR,conv-36-turn-1.gold.txt,"Hazırım, bekliyorum.",hazırım bekliyorum
tr-TR,conv-36-turn-10.gold.txt,"Sonu 67 ama tamam neyse, önemli değil.",sonu altmış yedi ama tamam neyse önemli değil
tr-TR,conv-36-turn-11.gold.txt,Yok çok teşekkür ederim.,yok çok teşekkür ederim
tr-TR,conv-36-turn-12.gold.txt,İyi günler.,iyi günler
tr-TR,conv-36-turn-2.gold.txt,Maalesef bu takip kodu çok karışık. Daha normal ve kodlayarak söyler misiniz acaba?,maalesef bu takip kodu çok karışık daha normal ve kodlayarak söyler misiniz acaba
tr-TR,conv-36-turn-3.gold.txt,"Ceyhan, Niğde 3 4 2. Doğru mudur?",ceyhan niğde üç dört iki doğru mudur
tr-TR,conv-36-turn-4.gold.txt,"Evet, doğru.",evet doğru
tr-TR,conv-36-turn-5.gold.txt,Adım Zaynep Arslan.,adım zaynep arslan
tr-TR,conv-36-turn-6.gold.txt,E-postam Zaynep nokta Arslan at email nokta com.,e postam zaynep nokta arslan at email nokta com
tr-TR,conv-36-turn-7.gold.txt,"Tabii, hemen okuyorum. Telefon numaram artı 90 123 0 90 45 67.",tabii hemen okuyorum telefon numaram artı doksan bir yüz yirmi üç sıfır doksan kırk beş altmış yedi
tr-TR,conv-36-turn-8.gold.txt,Telefon numaramda yanlışlık var. Artı 90 123 0 90 45 67.,telefon numaramda yanlışlık var artı doksan bir iki üç sıfır doksan kırk beş altmış yedi
tr-TR,conv-36-turn-9.gold.txt,Sonu 67. 65 değil.,sonu altmış yedi altmış beş değil
tr-TR,conv-37-turn-0.gold.txt,"Anna Hanım merhabalar. Ben son internet faturamın miktarını öğrenmek istiyorum. Acaba ödendi mi, ödenmedi mi, o konuda bilgi verebilir misiniz acaba?",anna hanım merhabalar ben son internet faturamın miktarını öğrenmek istiyorum acaba ödendi mi ödenmedi mi o konuda bilgi verebilir misiniz acaba
tr-TR,conv-37-turn-1.gold.txt,Bekliyorum.,bekliyorum
tr-TR,conv-37-turn-10.gold.txt,"Tabii. Atatürk Caddesi No 45 taksim 6, Kazım Karabekir Mahallesi, Üsküdar taksim İstanbul. Posta kodum 34 660 Türkiye.",tabii atatürk caddesi no kırk beş taksim altı kazım karabekir mahallesi üsküdar taksim istanbul posta kodum otuz dört altı yüz altmış türkiye
tr-TR,conv-37-turn-11.gold.txt,Doğrudur.,doğrudur
tr-TR,conv-37-turn-12.gold.txt,"Olur, teşekkürler.",olur teşekkürler
tr-TR,conv-37-turn-13.gold.txt,Yok teşekkürler.,yok teşekkürler
tr-TR,conv-37-turn-2.gold.txt,Hayır alamadım çünkü araya İngilizce de serpiştirdiniz. Ben gayet Türkçe bir takip kodu alabilir miyim? Lütfen yavaşça.,hayır alamadım çünkü araya ingilizce de serpiştirdiniz ben gayet türkçe bir takip kodu alabilir miyim lütfen yavaşça
tr-TR,conv-37-turn-3.gold.txt,"Jandarma, Ceyhan 1 9 9 5.",jandarma ceyhan bin dokuz yüz doksan beş
tr-TR,conv-37-turn-4.gold.txt,Adım Zaynep Arslan.,adım zaynep arslan
tr-TR,conv-37-turn-5.gold.txt,E-posta adresim Zaynep nokta Arslan at email nokta com.,e posta adresim zaynep nokta arslan at email nokta com
tr-TR,conv-37-turn-6.gold.txt,"O zaman kodluyorum. Zonguldak, Adana, Yalova, Niğde, Edirne, Polatlı, nokta Adana, Rize, Sivas, Lüleburgaz, Adana, Niğde at email nokta com.",o zaman kodluyorum zonguldak adana yalova niğde edirne polatlı nokta adana rize sivas lüleburgaz adana niğde at email nokta com
tr-TR,conv-37-turn-7.gold.txt,Doğru.,doğru
tr-TR,conv-37-turn-8.gold.txt,Telefon numaram artı 90 123 0 90 45 67.,telefon numaram artı doksan bir iki üç sıfır doksan kırk beş altmış yedi
tr-TR,conv-37-turn-9.gold.txt,Hayır doğru değil. Artı 90 123 0 90 45 67.,hayır doğru değil artı doksan yüz yirmi üç sıfır doksan kırk beş altmış yedi
tr-TR,conv-38-turn-0.gold.txt,Anna Hanım merhabalar. Ben kredi kartımdaki son kalan limitimi öğrenmek istiyorum. Yani kalan bakiyem nedir? Limite dair.,anna hanım merhabalar ben kredi kartımdaki son kalan limitimi öğrenmek istiyorum kalan bakiyem nedir limite dair
tr-TR,conv-38-turn-1.gold.txt,Evet isterim. Ancak birazcık yavaş okursanız sevinirim. Tamamen Türkçe harflerden oluşsun lütfen.,evet isterim ancak birazcık yavaş okursanız sevinirim tamamen türkçe harflerden oluşsun lütfen
tr-TR,conv-38-turn-10.gold.txt,Yok teşekkür ederim o zaman. Kolay gelsin.,yok teşekkür ederim o zaman kolay gelsin
tr-TR,conv-38-turn-11.gold.txt,"İyi günler, teşekkürler.",iyi günler teşekkürler
tr-TR,conv-38-turn-2.gold.txt,"Denizli, Ordu 0 6 8 0. Doğru mu?",denizli ordu sıfır altı sekiz sıfır doğru mu
tr-TR,conv-38-turn-3.gold.txt,"Tabii, adım Zaynep Arslan.",tabii adım zaynep arslan
tr-TR,conv-38-turn-4.gold.txt,"Tabii, mailim Zaynep nokta Arslan at email nokta com.",tabii mailim zaynep nokta arslan at email nokta com
tr-TR,conv-38-turn-5.gold.txt,Telefon numaram artı 90 123 0 90 45 67.,telefon numaram artı doksan yüz yirmi üç sıfır doksan kırk beş altmış yedi
tr-TR,conv-38-turn-6.gold.txt,Hayır telefon numaram tamamen yanlış. Tekrar vereyim. Artı 90 123 0 90 45 67.,hayır telefon numaram tamamen yanlış tekrar vereyim artı doksan bir yüz yirmi üç sıfır doksan kırk beş altmış yedi
tr-TR,conv-38-turn-7.gold.txt,Tamam.,tamam
tr-TR,conv-38-turn-8.gold.txt,İşleniyor derken ne demek istediniz? Ben bakiyeyi öğrenmek istiyorum. Yani kalan limitin miktarı nedir?,işleniyor derken ne demek istediniz ben bakiyeyi öğrenmek istiyorum kalan limitin miktarı nedir
tr-TR,conv-38-turn-9.gold.txt,Olur. Olur tamam çok iyi olur.,olur olur tamam çok iyi olur
tr-TR,conv-39-turn-0.gold.txt,Anna Hanım merhabalar. Ben kredi kartında otomatik ödeme yapabilir miyim? Onu merak ettiğim için aradım.,anna hanım merhabalar ben kredi kartında otomatik ödeme yapabilir miyim onu merak ettiğim için aradım
tr-TR,conv-39-turn-1.gold.txt,Olur ancak bana bir tane kod vermeyecek misiniz?,olur ancak bana bir tane kod vermeyecek misiniz
tr-TR,conv-39-turn-10.gold.txt,Artı 90 123 0 90 45 67.,artı doksan yüz yirmi üç sıfır doksan kırk beş altmış yedi
tr-TR,conv-39-turn-11.gold.txt,Doğrudur.,doğrudur
tr-TR,conv-39-turn-12.gold.txt,Yok teşekkür ederim. O zaman kolay gelsin.,yok teşekkür ederim o zaman kolay gelsin
tr-TR,conv-39-turn-2.gold.txt,Tabii ki Anna.,tabii ki anna
tr-TR,conv-39-turn-3.gold.txt,"Bursa, Van 1 1 3 5.",bursa van bir bir üç beş
tr-TR,conv-39-turn-4.gold.txt,Yalnız sizin.,yalnız sizin
tr-TR,conv-39-turn-5.gold.txt,"Tabii ek bilgi alırım o zaman sizden, eğer aktarılıyorsa. Ben eğer otomatik ödeme yaparsam limitim yetmediği takdirde nasıl bir yol izlemeliyim?",tabii ek bilgi alırım o zaman sizden eğer aktarılıyorsa ben eğer otomatik ödeme yaparsam limitim yetmediği takdirde nasıl bir yol izlemeliyim
tr-TR,conv-39-turn-6.gold.txt,O zaman bana fatura bilgilerimi verebilir misiniz? Yani ekstre bilgileri.,o zaman bana fatura bilgilerimi verebilir misiniz ekstre bilgileri
tr-TR,conv-39-turn-7.gold.txt,İsmim Zaynep Arslan.,ismim zaynep arslan
tr-TR,conv-39-turn-8.gold.txt,E-posta adresim Zaynep nokta Arslan at email nokta com.,e posta adresim zaynep nokta arslan at email nokta com
tr-TR,conv-39-turn-9.gold.txt,Zaynep nokta Arslan at email nokta com.,zaynep nokta arslan at email nokta com
tr-TR,conv-4-turn-0.gold.txt,"Merhaba, kart limitimi artırmak istiyorum.",merhaba kart limitimi artırmak istiyorum
tr-TR,conv-4-turn-1.gold.txt,"Tabii, okuyorum, dinliyorum.",tabii okuyorum dinliyorum
tr-TR,conv-4-turn-10.gold.txt,"Tabii, aktarabilirsiniz, teşekkür ederim.",tabii aktarabilirsiniz teşekkür ederim
tr-TR,conv-4-turn-11.gold.txt,"Hayır, istemiyorum. İyi günler dilerim.",hayır istemiyorum iyi günler dilerim
tr-TR,conv-4-turn-2.gold.txt,C N 662. 6 6 2.,c n altı yüz altmış iki altı altı iki
tr-TR,conv-4-turn-3.gold.txt,Ahmet nokta Arslan at email nokta com.,ahmet nokta arslan at email nokta com
tr-TR,conv-4-turn-4.gold.txt,Artı 90 123 0 90 45 67.,artı doksan bir yüz yirmi üç sıfır doksan kırk beş altmış yedi
tr-TR,conv-4-turn-5.gold.txt,"Evet, onaylıyorum.",evet onaylıyorum
tr-TR,conv-4-turn-6.gold.txt,Ne zaman bildirim göndereceksiniz siz? Anlayamadım.,ne zaman bildirim göndereceksiniz siz anlayamadım
tr-TR,conv-4-turn-7.gold.txt,"Tamam gönderebilirsiniz, bekliyorum.",tamam gönderebilirsiniz bekliyorum
tr-TR,conv-4-turn-8.gold.txt,"Evet, onay aldım. İşlem tamamlandı mı şimdi?",evet onay aldım işlem tamamlandı mı şimdi
tr-TR,conv-4-turn-9.gold.txt,Limit artışım ne kadar oldu acaba? Ben anlayamadım da.,limit artışım ne kadar oldu acaba ben anlayamadım da
tr-TR,conv-40-turn-0.gold.txt,"Anna merhaba. Daha önce bir talebim olmuştu, onun için arıyorum. Şu ana kadar gerçekleşmedi çünkü.",anna merhaba daha önce bir talebim olmuştu onun için arıyorum şu ana kadar gerçekleşmedi çünkü
tr-TR,conv-40-turn-1.gold.txt,Anna kredi kartımın limitini artırmak istiyorum.,anna kredi kartımın limitini artırmak istiyorum
tr-TR,conv-40-turn-10.gold.txt,Tamam.,tamam
tr-TR,conv-40-turn-11.gold.txt,"Email daha vermedin, email vereyim ben sana. Ahmet nokta Arslan A R S L A N at email nokta com.",email daha vermedin email vereyim ben sana ahmet nokta arslan a r s l a n at email nokta com
tr-TR,conv-40-turn-12.gold.txt,"Hayır yanlış yazdın. Tamamen yanlış almışsın, tekrar söylüyorum, harf harf kodluyorum. Adana, Hatay, Muğla, Edirne, Trabzon nokta Adana, Rize, Samsun, Lüleburgaz, Adana, Niğde at email nokta com.",hayır yanlış yazdın tamamen yanlış almışsın tekrar söylüyorum harf harf kodluyorum adana hatay muğla edirne trabzon adana rize samsun lüleburgaz adana niğde at email com
tr-TR,conv-40-turn-13.gold.txt,"Sonu Gmail değil email, G yok. Sadece email nokta com.",sonu gmail değil email g yok sadece email nokta com
tr-TR,conv-40-turn-14.gold.txt,"Doğrudur, evet.",doğrudur evet
tr-TR,conv-40-turn-15.gold.txt,Yazıyor musun? Artı 90 123.,yazıyor musun artı doksan bir iki üç
tr-TR,conv-40-turn-16.gold.txt,Hayır baştan söylüyorum beni kesmeden dinle lütfen. Artı 90 123 0 90 45 67.,hayır baştan söylüyorum beni kesmeden dinle lütfen artı doksan bir iki üç sıfır doksan kırk beş altmış yedi
tr-TR,conv-40-turn-17.gold.txt,"Doğrudur, onaylıyorum.",doğrudur onaylıyorum
tr-TR,conv-40-turn-18.gold.txt,"Tamam, gönderebilirsin.",tamam gönderebilirsin
tr-TR,conv-40-turn-19.gold.txt,"Evet, onayladım.",evet onayladım
tr-TR,conv-40-turn-2.gold.txt,"Yazıyorum, söyleyin lütfen.",yazıyorum söyleyin lütfen
tr-TR,conv-40-turn-20.gold.txt,"Anna, bana şu kodu tekrar verir misin? Kodlar çünkü ilk başta E N dedin sonra E A dedin. Kodu tekrar bana söyler misin yavaşça?",anna bana şu kodu tekrar verir misin kodlar çünkü ilk başta e n dedin sonra e a dedin kodu tekrar bana söyler misin yavaşça
tr-TR,conv-40-turn-21.gold.txt,Not aldım evet. Anna bir nokta daha var. Bir şey istiyorum senden.,not aldım evet anna bir nokta daha var bir istiyorum senden
tr-TR,conv-40-turn-22.gold.txt,"Daha önce hesap ekstresi istemiştim, aylık. İstediğim şu ana kadar gelmedi, bana gönderebilir misin hesap ekstresini?",daha önce hesap ekstresi istemiştim aylık istediğim şu ana kadar gelmedi bana gönderebilir misin hesap ekstresini
tr-TR,conv-40-turn-23.gold.txt,"Şu an itibari ile yok, teşekkür ederim.",şu an itibari ile yok teşekkür ederim
tr-TR,conv-40-turn-24.gold.txt,"İyi çalışmalar diliyorum, kolay gelsin.",iyi çalışmalar diliyorum kolay gelsin
tr-TR,conv-40-turn-25.gold.txt,"İyi çalışmalar, kolay gelsin.",iyi çalışmalar kolay gelsin
